Я не знал толком .	ты не знал толком .
Знаю я эти места .	знаешь ты эти места .
Слыхал я про Нобеля .	Слыхал ты про Нобеля .
Я не пью пива .	ты не пьешь пива .
А сейчас я спешу ...	А сейчас ты спешишь ...
Я худо ел нынче .	ты худо ел нынче .
С кем я торгую ?	С кем ты торгуешь ?
И спички я захватил .	И спички ты захватил .
Вышел я во двор ...	Вышел ты во двор ...
Я на огонь шел ...	ты на огонь шел ...
Я думаю - знает .	ты думаешь - знает .
Видно , ошибся я .	Видно , ошибся ты .
Я один здесь останусь .	ты один здесь останешься .
Я ещё провалился тогда .	ты ещё провалился тогда .
Я вышел на мостик .	ты вышел на мостик .
Я протянул бинокль штурману .	ты протянул бинокль штурману .
Я выглянул за дверь .	ты выглянул за дверь .
Я тоже подхватил звено .	ты тоже подхватил звено .
Я спустился в каюту .	ты спустился в каюту .
Взялся за шланг я .	Взялся за шланг ты .
А я вдруг встревожился .	А ты вдруг встревожился .
Я побежал в малярку .	ты побежал в малярку .
Я поднялся в рубку .	ты поднялся в рубку .
Я выбежал на мостик .	ты выбежал на мостик .
Вот я и вспомнил .	Вот ты и вспомнил .
Я затянул ещё сильней .	ты затянул ещё сильней .
Я постучал в рулевую .	ты постучал в рулевую .
Я перечитал радиограмму снова .	ты перечитал радиограмму снова .
Я тоже сделал снимок .	ты тоже сделал снимок .
Я спустился на корму .	ты спустился на корму .
Я посмотрел на капитана .	ты посмотрел на капитана .
Я повернулся к агенту .	ты повернулся к агенту .
Я бросился за капитаном .	ты бросился за капитаном .
Я даже руки опустил .	ты даже руки опустил .
Тут я всё понял .	Тут ты всё понял .
Сбегал я за фотоаппаратом .	Сбегал ты за фотоаппаратом .
Я на пароходе плаваю ?	ты на пароходе плаваешь ?
Тут - то я Ваню вспомнил .	Тут - то ты Ваню вспомнил .
Я немедленно напишу статью .	ты немедленно напишешь статью .
Я сел за повесть .	ты сел за повесть .
Я останусь с Солнышкиным .	ты останешься с Солнышкиным .
Я попал не туда !	ты попал не туда !
Я постучал и уборщицам .	ты постучал и уборщицам .
Я побежал на мостик .	ты побежал на мостик .
Я с волнением вглядывался .	ты с волнением вглядывался .
И я тоже улыбался .	И ты тоже улыбался .
Спрыгнул я у Капитолия .	Спрыгнул ты у Капитолия .
Вечером я учу стариков .	Вечером ты учишь стариков .
Али я нахлебником стал ?	Али ты нахлебником стал ?
Я все правильно рассчитал ...	ты все правильно рассчитал ...
Я показывал документы милиционеру .	ты показывал документы милиционеру .
И когда я вернусь ...	И когда ты вернешься ...
Я спрятался в саду .	ты спрятался в саду .
Я ушел в подполье ...	ты ушел в подполье ...
Я хочу скорее домой !	ты хочешь скорее домой !
Чтоб я месила тесто ?	Чтоб ты месила тесто ?
Я же правду сказала .	ты же правду сказала .
Я размышляю о любви ;	ты размышляешь о любви ;
Когда я снова стану маленьким	Когда ты снова станешь маленьким
Но я как-то стыжусь .	Но ты как-то стыдишься .
Словно я стыжусь чего-то ...	Словно ты стыдишься чего-то ...
А я не могу .	А ты не можешь .
Я поклонился , иду .	ты поклонился , идешь .
Первому я отвечаю спокойно .	Первому ты отвечаешь спокойно .
И вот я рисую .	И вот ты рисуешь .
И я тоже улыбнулся .	И ты тоже улыбнулся .
Я кормил саму весну .	ты кормил саму весну .
Я умывался холодной водой .	ты умывался холодной водой .
Я тащусь по направлению к углу .	ты тащишься по направлению к углу .
Я заплатил и еду .	ты заплатил и едешь .
Теперь я быстро одеваюсь .	Теперь ты быстро одеваешься .
Но я не ухожу .	Но ты не уходишь .
Что бы я ответил ?	Что бы ты ответил ?
Я бегу к сторожу .	ты бежишь к сторожу .
Я смотрю по сторонам .	ты смотришь по сторонам .
Наконец я дождался звонка .	Наконец ты дождался звонка .
Я спрятался за Томчака .	ты спрятался за Томчака .
Теперь я думаю иначе ;	Теперь ты думаешь иначе ;
Я ничего не отвечаю .	ты ничего не отвечаешь .
Что я скажу Бончкевичу ?	Что ты скажешь Бончкевичу ?
А я все молчу .	А ты все молчишь .
Я ответ сразу узнал .	ты ответ сразу узнал .
А я рядом стоял .	А ты рядом стоял .
Наконец я нашел пальто .	Наконец ты нашел пальто .
Сейчас я все объясню .	Сейчас ты все объяснишь .
Я разделяю ваше горе .	ты разделяешь ваше горе .
Я смотрел на луну .	ты смотрел на луну .
Тогда я вспоминаю родину .	Тогда ты вспоминаешь родину .
Я завел две тетради .	ты завел две тетради .
А  то я уже беспокоился .	А  то ты уже беспокоился .
А я незаслуженно страдаю .	А ты незаслуженно страдаешь .
Часы тоже я испортил .	Часы тоже ты испортил .
Я еду на фронт .	ты едешь на фронт .
Я был на вокзале .	ты был на вокзале .
Разве я неправду говорю ?	Разве ты неправду говоришь ?
Я был против войны .	ты был против войны .
Я не стал людоедом .	ты не стал людоедом .
Когда я получил отставку ...	Когда ты получил отставку ...
И я составил план .	И ты составил план .
С тех пор я стал осторожнее .	С тех пор ты стал осторожнее .
Я знаю такой случай .	ты знаешь такой случай .
Я видел три войны .	ты видел три войны .
И я курю папиросы .	И ты куришь папиросы .
Завтра я один управлюсь .	Завтра ты один управишься .
Я борюсь с собой .	ты борешься с собой .
Я повторяю - физик .	ты повторяешь - физик .
Я привыкла к обстановке .	ты привыкла к обстановке .
Я следил за дорогой .	ты следил за дорогой .
Скорость я не сбавлял .	Скорость ты не сбавлял .
Потом услышал и я .	Потом услышал и ты .
Я наблюдаю за Киром .	ты наблюдаешь за Киром .
Я собиралась в театр .	ты собиралась в театр .
Я и дождь люблю .	ты и дождь любишь .
Вот я и спрашиваю .	Вот ты и спрашиваешь .
И я так думаю .	И ты так думаешь .
Я видела собственными глазами !	ты видела собственными глазами !
Я думал - семена .	ты думал - семена .
Я Игнашке панихиду сыграю .	ты Игнашке панихиду сыграешь .
Я слышал звук виолончели .	ты слышал звук виолончели .
Видел только я один .	Видел только ты один .
Я тоже очень расстроился .	ты тоже очень расстроился .
Я построил уникальнешего робота !	ты построил уникальнешего робота !
Я вспомнил любопытную картину .	ты вспомнил любопытную картину .
Я критически оглядел дочку .	ты критически оглядел дочку .
Ну не понимаю я !	Ну не понимаешь ты !
Был я в театре .	Был ты в театре .
И я много путешествовал .	И ты много путешествовал .
Я на войне был .	ты на войне был .
Я разговариваю с водителями .	ты разговариваешь с водителями .
Я лезу в обзор .	ты лезешь в обзор .
Я вспомнил этакое словечко .	ты вспомнил этакое словечко .
Я уже не вздрагиваю .	ты уже не вздрагиваешь .
Я попала в беду .	ты попала в беду .
Я теперь не знаю .	ты теперь не знаешь .
Так я стал писателем .	Так ты стал писателем .
Я отрицательно покачал головой .	ты отрицательно покачал головой .
А я не шевелился .	А ты не шевелился .
Я не придумываю рассказы .	ты не придумываешь рассказы .
А куда денусь я ?	А куда денешься ты ?
Это я взял Блестящик !	Это ты взял Блестящик !
Я торчу из окна .	ты торчишь из окна .
А я остался наверху .	А ты остался наверху .
Да и я едва сдерживался .	Да и ты едва сдерживался .
Я медленно выпил всё .	ты медленно выпил всё .
Я без крыльев летал .	ты без крыльев летал .
Но я не хотела ...	Но ты не хотела ...
Я имею ввиду ссоры .	ты имеешь ввиду ссоры .
И я узнаю правду .	И ты узнаешь правду .
Я был тогда другим .	ты был тогда другим .
Я в колледже остался .	ты в колледже остался .
Я на марку посмотрел .	ты на марку посмотрел .
Я пошел на кухню .	ты пошел на кухню .
Я мечтал о России .	ты мечтал о России .
Я ушам не поверил .	ты ушам не поверил .
Я лечу в высоту .	ты летишь в высоту .
Я подумал , подумал .	ты подумал , подумал .
Я сначала даже присел .	ты сначала даже присел .
Я встал каким-то самолетиком .	ты встал каким-то самолетиком .
Я шагнул в темноту .	ты шагнул в темноту .
Я стою , жду .	ты стоишь , ждешь .
Я ждал , ждал .	ты ждал , ждал .
Да и как я уйду ?	Да и как ты уйдешь ?
Документы , я сказал .	Документы , ты сказал .
Я пошел по улице .	ты пошел по улице .
Я пошел в переулок .	ты пошел в переулок .
Я смотрю в полглаза .	ты смотришь в полглаза .
Ну , я свалился .	Ну , ты свалился .
Я смотрю - ноги .	ты смотришь - ноги .
Я подошел , выключил .	ты подошел , выключил .
Я пошел на цыпочках .	ты пошел на цыпочках .
Я ничего не делал .	ты ничего не делал .
Я пополз , залег ...	ты пополз , залег ...
Я завел и поехал .	ты завел и поехал .
Тут я как разозлюсь !	Тут ты как разозлишься !
Я боюсь этих людей .	ты боишься этих людей .
Я в затылке почесал .	ты в затылке почесал .
Я посмотрел под ноги .	ты посмотрел под ноги .
Сейчас я владею указкой .	Сейчас ты владеешь указкой .
Я воспитал чистого мальчика .	ты воспитал чистого мальчика .
Я уже видел проход .	ты уже видел проход .
Я буду верной женой .	ты будешь верной женой .
Я проклинал убогого министра .	ты проклинал убогого министра .
Я лечу на крыльях .	ты летишь на крыльях .
И я стал Сашей .	И ты стал Сашей .
Но я не злорадствовал .	Но ты не злорадствовал .
И тут я заревел .	И тут ты заревел .
Но я махнул рукой .	Но ты махнул рукой .
И все-таки я сник .	И все-таки ты сник .
Я это дело предвидел .	ты это дело предвидел .
Покряхтев , я поднялся .	Покряхтев , ты поднялся .
Рубашку я надел навыпуск .	Рубашку ты надел навыпуск .
Я взял увесистую авоську .	ты взял увесистую авоську .
Я задержался у порога .	ты задержался у порога .
Сперва я не отозвался .	Сперва ты не отозвался .
Я тоже помахал Ивке .	ты тоже помахал Ивке .
Я походил по комнатам .	ты походил по комнатам .
Я оглянулся на дверь .	ты оглянулся на дверь .
Я с готовностью посмотрел .	ты с готовностью посмотрел .
Тогда я не выдержал .	Тогда ты не выдержал .
Я сумрачно пожал плечами .	ты сумрачно пожал плечами .
Я отошел на цыпочках .	ты отошел на цыпочках .
Прежде всего я увидел камин .	Прежде всего ты увидел камин .
Я видел на картинке .	ты видел на картинке .
Я сел к столу .	ты сел к столу .
Я чуть не завыл .	ты чуть не завыл .
Я разозлился на себя .	ты разозлился на себя .
Ничего я не забыл !	Ничего ты не забыл !
Утром я не встал .	Утром ты не встал .
Я плотно сжал губы .	ты плотно сжал губы .
Я оглянулся на бабушку .	ты оглянулся на бабушку .
Я сперва не узнал .	ты сперва не узнал .
Я звонил , звонил ...	ты звонил , звонил ...
Я так и собирался .	ты так и собирался .
Я оглянулся на город .	ты оглянулся на город .
Я утром не поел ...	ты утром не поел ...
Я не знаю сколько .	ты не знаешь сколько .
Тогда я взял шапку .	Тогда ты взял шапку .
Я как увидел это ...	ты как увидел это ...
Но что я могу ?	Но что ты можешь ?
И я заспешил домой .	И ты заспешил домой .
Ну , я понимаю ...	Ну , ты понимаешь ...
Я звонила в магазин .	ты звонила в магазин .
А что могу я ?	А что можешь ты ?
Я там и живу .	ты там и живешь .
Больше всех мучился я .	Больше всех мучился ты .
Так я иногда думал .	Так ты иногда думал .
А кого я объединил ?	А кого ты объединил ?
Я ничуть не удивляюсь .	ты ничуть не удивляешься .
Так я думал ночью .	Так ты думал ночью .
Я же не хотел !	ты же не хотел !
А хлеба я взял .	А хлеба ты взял .
А куда я шел ?	А куда ты шел ?
Я понятия не имел .	ты понятия не имел .
Я говорю про людей .	ты говоришь про людей .
Часы я оставил дома ...	Часы ты оставил дома ...
Я сел на корточки .	ты сел на корточки .
Я никогда не узнаю .	ты никогда не узнаешь .
Я же хорошо плаваю .	ты же хорошо плаваешь .
Я даже не ожидал .	ты даже не ожидал .
Я удивился знаешь когда ?	ты удивился знаешь когда ?
Я узнал от чаек .	ты узнал от чаек .
Я правильно сделал вывод ?	ты правильно сделал вывод ?
Я к Янчику схожу ...	ты к Янчику сходишь ...
В общем , я узнал .	В общем , ты узнал .
Вот я и есть !	Вот ты и есть !
Иначе бы я помнил ...	Иначе бы ты помнил ...
Я честное слово дал .	ты честное слово дал .
Я у бабушки спрошу ...	ты у бабушки спросишь ...
Я старый репейник рублю .	ты старый репейник рубишь .
Я еще не решил ...	ты еще не решил ...
Я сейчас вахтера позову .	ты сейчас вахтера позовешь .
Я только немного подрыла .	ты только немного подрыла .
Только я не знаю ...	Только ты не знаешь ...
Я про космос собираю .	ты про космос собираешь .
Я тут недавно живу .	ты тут недавно живешь .
Я сразу все вспомнил .	ты сразу все вспомнил .
Я не помню всего .	ты не помнишь всего .
Я вдруг почувствовал ужас .	ты вдруг почувствовал ужас .
Я лег на траву .	ты лег на траву .
Я не понял Георгия .	ты не понял Георгия .
Я взглянул на Георгия .	ты взглянул на Георгия .
Потом я распахнул окно .	Потом ты распахнул окно .
Младшего я помню лучше .	Младшего ты помнишь лучше .
Я занялся своей раной .	ты занялся своей раной .
Я так не мог !	ты так не мог !
Я шагнул к мечу .	ты шагнул к мечу .
Но ведь я возвращаюсь .	Но ведь ты возвращаешься .
Я лениво повернул голову .	ты лениво повернул голову .
Я посмотрел на Валерку .	ты посмотрел на Валерку .
Я остановился от неожиданности .	ты остановился от неожиданности .
Я снова стал мальчишкой !	ты снова стал мальчишкой !
Стены я разглядел лучше .	Стены ты разглядел лучше .
Я взглянул на луну .	ты взглянул на луну .
Но я не понимаю ...	Но ты не понимаешь ...
Только не привык я ...	Только не привык ты ...
Как я не подумал !	Как ты не подумал !
Разве я когда-нибудь трусил ?	Разве ты когда-нибудь трусил ?
Я жду , жду ...	ты ждешь , ждешь ...
Я опять открыл глаза .	ты опять открыл глаза .
Я переглатывал и кашлял .	ты переглатывал и кашлял .
Я рванулся к постели .	ты рванулся к постели .
Я потянул медную скобу .	ты потянул медную скобу .
Не я писал Книги !	Не ты писал Книги !
Я порвал проклятую цепь ...	ты порвал проклятую цепь ...
Я брел и улыбался .	ты брел и улыбался .
Я проспал почти до полудня .	ты проспал почти до полудня .
Я перевернулся на спину .	ты перевернулся на спину .
Я лежал на плотике .	ты лежал на плотике .
Раньше здесь жил я .	Раньше здесь жил ты .
Но я не отступал .	Но ты не отступал .
Тогда я опустил раковину .	Тогда ты опустил раковину .
Ничего я не видел .	Ничего ты не видел .
Я качнулся Валерке навстречу .	ты качнулся Валерке навстречу .
Ладно , я попробую .	Ладно , ты попробуешь .
Я понял и подскочил .	ты понял и подскочил .
А я чепуху ответил .	А ты чепуху ответил .
Я взглянул на Валерку .	ты взглянул на Валерку .
Я посмотрел на Володьку .	ты посмотрел на Володьку .
С мамой я договорюсь .	С мамой ты договоришься .
А что я сделаю ?	А что ты сделаешь ?
Потому что я такой уродился .	Потому что ты такой уродился .
Я подожду у калитки .	ты подождешь у калитки .
Я даже очки уронила .	ты даже очки уронила .
И потому я спешу .	И потому ты спешишь .
Никуда я не пойду !	Никуда ты не пойдешь !
А как я объясню ?	А как ты объяснишь ?
А я так удивилась ...	А ты так удивилась ...
Просто я не знаю ...	Просто ты не знаешь ...
Я давно это понял .	ты давно это понял .
Я так уже делал .	ты так уже делал .
Ой , я побежала ...	Ой , ты побежала ...
Ничего я не помню .	Ничего ты не помнишь .
Я сам знаю протоку .	ты сам знаешь протоку .
Я ведь только спросил .	ты ведь только спросил .
Вот это я поспал !	Вот это ты поспал !
Ничего я не ронял !	Ничего ты не ронял !
Когда я домой попаду ?	Когда ты домой попадешь ?
Я люблю новые места .	ты любишь новые места .
Я задам другой вопрос .	ты задашь другой вопрос .
Я вот составлю донесение ...	ты вот составишь донесение ...
Я пошел к реке .	ты пошел к реке .
Я сначала все обдумаю .	ты сначала все обдумаешь .
Я ошибся , извини ...	ты ошибся , извини ...
Я думал об этом .	ты думал об этом .
