Я прерываю свой репортаж !	ты прерываешь свой репортаж !
Ой , я боюсь !	Ой , ты боишься !
Я больше не могу !	ты больше не можешь !
Я едва не оглох .	ты едва не оглох .
Но я не погибла .	Но ты не погибла .
Я отлично все рассчитала !	ты отлично все рассчитала !
Так я и думал !	Так ты и думал !
Я знаю этот народец .	ты знаешь этот народец .
Я кинулся в лабораторию .	ты кинулся в лабораторию .
Глазами , я сказала !	Глазами , ты сказала !
Вот я сейчас пройду ...	Вот ты сейчас пройдешь ...
Я даже не знала ...	ты даже не знала ...
Я с детства привыкла .	ты с детства привыкла .
Я целый магазин съел .	ты целый магазин съел .
Ну , пошел я ...	Ну , пошел ты ...
А теперь я побежала .	А теперь ты побежала .
Я не видел куда !	ты не видел куда !
Я тут кое-что узнала ...	ты тут кое-что узнала ...
Я спрашиваю , кто ?	ты спрашиваешь , кто ?
А я был великаном !	А ты был великаном !
Я гонялся за кошками !	ты гонялся за кошками !
Теперь тут буду я !	Теперь тут будешь ты !
Я обо всем догадывалась !	ты обо всем догадывалась !
Этого я не предусмотрела !	Этого ты не предусмотрела !
Я все равно добьюсь своего !	ты все равно добьешься своего !
Я ничего не понял !	ты ничего не понял !
Я просто сделаю запись .	ты просто сделаешь запись .
Я возвращаюсь в Тиби ...	ты возвращаешься в Тиби ...
Я ворвалась в комнату .	ты ворвалась в комнату .
Я хочу в Тибидохс ...	ты хочешь в Тибидохс ...
Я лично не видел .	ты лично не видел .
Помню я его ковчег !	помнишь ты его ковчег !
Почему я вчера промолчала ?	Почему ты вчера промолчала ?
Я этого не знаю .	ты этого не знаешь .
Я знаю свой организм !	ты знаешь свой организм !
Я много чего могу .	ты много чего можешь .
Это не я придумал .	Это не ты придумал .
Я сам чудом выжил !	ты сам чудом выжил !
Я не люблю неожиданностей .	ты не любишь неожиданностей .
Я схожу с ума !	ты сходишь с ума !
Я на солнце сгораю .	ты на солнце сгораешь .
А я не издеваюсь !	А ты не издеваешься !
Я бегу к Сарданапалу !	ты бежишь к Сарданапалу !
Это я уже слышал !	Это ты уже слышал !
Давай я вызову консьержку !	Давай ты вызовешь консьержку !
Но писал не я ...	Но писал не ты ...
Я спалил храм Артемиды !	ты спалил храм Артемиды !
А , я понял !	А , ты понял !
Я не люблю стихи !	ты не любишь стихи !
Я старшеклассников не распускаю !	ты старшеклассников не распускаешь !
Я золото всегда узнаю !	ты золото всегда узнаешь !
Я подняла с земли !	ты подняла с земли !
Я сбежал в Тибидохс !	ты сбежал в Тибидохс !
Тринадцатую я вписал только  что !	Тринадцатую ты вписал только  что !
Я аннулирую результаты матча !	ты аннулируешь результаты матча !
Я прекращу этот балаган !	ты прекратишь этот балаган !
Я никуда не спешу !	ты никуда не спешишь !
Я наткнулась на Поклепа .	ты наткнулась на Поклепа .
Ладно , пошел я .	Ладно , пошел ты .
Я же все  равно узнаю !	ты же все  равно узнаешь !
Дайте я сам догадаюсь !	Дайте ты сам догадаешься !
Я могу здорово лягацца !	ты можешь здорово лягацца !
Я опаздываю на телевидение !	ты опаздываешь на телевидение !
Я применю крайнее средство !	ты применишь крайнее средство !
Я была на презентации !	ты была на презентации !
Я придумал новое заклинание !	ты придумал новое заклинание !
Я сам себя обхитрил !	ты сам себя обхитрил !
Я просто не смог ...	ты просто не смог ...
О , я понимаю !	О , ты понимаешь !
В общем , я решился .	В общем , ты решился .
Вот я и дожидалась .	Вот ты и дожидалась .
Я магазинный не люблю .	ты магазинный не любишь .
Я уже многое повидал .	ты уже многое повидал .
Я выбрал себе профессию .	ты выбрал себе профессию .
Я провожу важные наблюдения .	ты проводишь важные наблюдения .
Я ездил , знаю .	ты ездил , знаешь .
Это я быстро бегаю .	Это ты быстро бегаешь .
Что-то я туго соображаю .	Что-то ты туго соображаешь .
Я же многое умею .	ты же многое умеешь .
Я не боюсь никого !	ты не боишься никого !
Я же сплю ночью .	ты же спишь ночью .
Я получил твоё письмо !	ты получил твоё письмо !
А я не знаю ...	А ты не знаешь ...
И я это хлебнул .	И ты это хлебнул .
Я знаю этот счёт .	ты знаешь этот счёт .
И я скоро пойду .	И ты скоро пойдешь .
Только я не покажу .	Только ты не покажешь .
Я возьму и куплю .	ты возьмешь и купишь .
Но я не падаю .	Но ты не падаешь .
Я заглядываю в сундук .	ты заглядываешь в сундук .
Я вышел на палубу .	ты вышел на палубу .
И я делал так же .	И ты делал так же .
Да , я молчал .	Да , ты молчал .
Я корабль космический веду .	ты корабль космический ведешь .
Я этих троллей видел .	ты этих троллей видел .
Что я не сделал ?	Что ты не сделал ?
Я подсмотрел в пособии .	ты подсмотрел в пособии .
Я отменяю Открытый урок .	ты отменяешь Открытый урок .
Да разве я стесняюсь ...	Да разве ты стесняешься ...
Можно я что-нибудь сломаю ?	Можно ты что-нибудь сломаешь ?
Я с Белым договорюсь .	ты с Белым договоришься .
Кажется я совсем заработался .	Кажется ты совсем заработался .
Ну , я показала !	Ну , ты показала !
А зачем я учила ?	А зачем ты учила ?
Я же все выучила !	ты же все выучила !
Да я все понимаю ...	Да ты все понимаешь ...
Я больше не буду ...	ты больше не будешь ...
Я ничего не видел .	ты ничего не видел .
А этих я задержу .	А этих ты задержишь .
Но я не успел .	Но ты не успел .
Я так не думаю .	ты так не думаешь .
А что я знаю ?	А что ты знаешь ?
Откуда я взял гробокопателей ?	Откуда ты взял гробокопателей ?
Я не вижу противников !	ты не видишь противников !
Где я прячу Рыжика ?	Где ты прячешь Рыжика ?
Вперед , я говорю !	Вперед , ты говоришь !
Я все  равно не поеду !	ты все  равно не поедешь !
Но я что-нибудь придумаю .	Но ты что-нибудь придумаешь .
Я все  равно сделаю это .	ты все  равно сделаешь это .
Что-то я действительно расфантазировался ...	Что-то ты действительно расфантазировался ...
В чем я обманул ?	В чем ты обманул ?
Я уже рассказал семье .	ты уже рассказал семье .
Ну я и облажался .	Ну ты и облажался .
Я уже включил секундомер !	ты уже включил секундомер !
Так я стал мудлом .	Так ты стал мудлом .
Я взял тринадцать штук .	ты взял тринадцать штук .
Не возил я водку .	Не возил ты водку .
Я не переносил нежностей .	ты не переносил нежностей .
Я открыл и остолбенел .	ты открыл и остолбенел .
Я проверял по часам .	ты проверял по часам .
Я узнал Сашкин голос .	ты узнал Сашкин голос .
Я уже речь написал .	ты уже речь написал .
Я не буду жалостливым .	ты не будешь жалостливым .
От неожиданности я замер .	От неожиданности ты замер .
Я прошелся по рядам .	ты прошелся по рядам .
А я старался вовсю .	А ты старался вовсю .
Я был гордый человек .	ты был гордый человек .
Вот я и поддержал .	Вот ты и поддержал .
Я вышел из будки .	ты вышел из будки .
Я побежал в учительскую .	ты побежал в учительскую .
Я бежал , торопился .	ты бежал , торопился .
Я тоже поднял бокал .	ты тоже поднял бокал .
Я нес ее виолончель .	ты нес ее виолончель .
Вот почему я задумался .	Вот почему ты задумался .
Я на самом деле так думаю .	ты на самом деле так думаешь .
Но я не расстроился .	Но ты не расстроился .
Я принесла свежие булочки .	ты принесла свежие булочки .
Вот тут я ахнул .	Вот тут ты ахнул .
Я улыбнулся ее сообразительности .	ты улыбнулся ее сообразительности .
Я даже не оглянулся .	ты даже не оглянулся .
Я стоял и ждал .	ты стоял и ждал .
Я открыл и обалдел .	ты открыл и обалдел .
Наконец я открыл дверь .	Наконец ты открыл дверь .
Я эти очки ненавижу .	ты эти очки ненавидишь .
Я вернулся к маме .	ты вернулся к маме .
Я затарабанил по стеклу .	ты затарабанил по стеклу .
Я повернулся и побежал .	ты повернулся и побежал .
Я поискал глазами мать .	ты поискал глазами мать .
Утром я проснулся первым .	Утром ты проснулся первым .
Это я тоже знаю .	Это ты тоже знаешь .
Я повернулся и пошёл .	ты повернулся и пошёл .
На углу я оглянулся .	На углу ты оглянулся .
Вот я приведу отца ...	Вот ты приведешь отца ...
Я вышел во двор ...	ты вышел во двор ...
Я сел в четвёртый .	ты сел в четвёртый .
Я ничего не помню .	ты ничего не помнишь .
Там я увидел Хельмута .	Там ты увидел Хельмута .
Я вышел от Лайниса .	ты вышел от Лайниса .
И тогда появлюсь я .	И тогда появишься ты .
Разве я тогда трусил ?	Разве ты тогда трусил ?
Лучше я все расскажу .	Лучше ты все расскажешь .
Я посмотрел на Далю .	ты посмотрел на Далю .
Наконец я вернулся домой .	Наконец ты вернулся домой .
Я встал и пошел .	ты встал и пошел .
Я тоже схватила конфету .	ты тоже схватила конфету .
На  самом деле я не паясничала .	На  самом деле ты не паясничала .
И я тоже испугалась .	И ты тоже испугалась .
Я знал таких людей .	ты знал таких людей .
Димку я не догнала .	Димку ты не догнала .
Я от радости запрыгала ;	ты от радости запрыгала ;
Я крикнула от боли .	ты крикнула от боли .
А я что говорил ?	А ты что говорил ?
Я отдал последние медяки .	ты отдал последние медяки .
Но я кое-как понимал .	Но ты кое-как понимал .
Я спустился по трапу .	ты спустился по трапу .
А ремонт я понял .	А ремонт ты понял .
Я сильно положил руль .	ты сильно положил руль .
Я бросился к испанцу .	ты бросился к испанцу .
Я правил сзади веслом .	ты правил сзади веслом .
Я поспешил на голос .	ты поспешил на голос .
Наутро я растолкал пьяного .	Наутро ты растолкал пьяного .
Я видал ночной пароход .	ты видал ночной пароход .
Я рассказал о себе .	ты рассказал о себе .
Я выглядывал из-за штабеля .	ты выглядывал из-за штабеля .
Чтоб я пропал совсем .	Чтоб ты пропал совсем .
Я ушел в город .	ты ушел в город .
Я выстрелил в воздух .	ты выстрелил в воздух .
Правда , я слышал .	Правда , ты слышал .
Я сам таких видел .	ты сам таких видел .
Я и не тянусь .	ты и не тянешься .
Я много видел людей ...	ты много видел людей ...
Да , я покушаю ...	Да , ты покушаешь ...
Евреи , я говорю ...	Евреи , ты говоришь ...
Я уж не знаю ...	ты уж не знаешь ...
Я угадал , конечно .	ты угадал , конечно .
Я завтра чуть свет сбегаю .	ты завтра чуть свет сбегаешь .
Наших , я говорю .	Наших , ты говоришь .
Я уж говорил там ...	ты уж говорил там ...
Ну так я пойду !	Ну так ты пойдешь !
Ну , я собираюсь .	Ну , ты собираешься .
Я позвал старшего помощника .	ты позвал старшего помощника .
Я побежал за боцманом .	ты побежал за боцманом .
Я проснулся под утро .	ты проснулся под утро .
Я подал парусную нитку .	ты подал парусную нитку .
Я залез в кубрик .	ты залез в кубрик .
Я полез на борт .	ты полез на борт .
А я все стараюсь .	А ты все стараешься .
Ух , обозлился я .	Ух , обозлился ты .
Я жил у моря .	ты жил у моря .
Нет , я вру !	Нет , ты врешь !
Я сам скажу директору .	ты сам скажешь директору .
Я выглянул из-под палубы .	ты выглянул из-под палубы .
Я полез в туз .	ты полез в туз .
Я чуть приналег посильнее .	ты чуть приналег посильнее .
Но я не добежал .	Но ты не добежал .
Я посмотрел под койку .	ты посмотрел под койку .
И я погнал напролом .	И ты погнал напролом .
Я сел на козлы .	ты сел на козлы .
Я тронул и оглянулся .	ты тронул и оглянулся .
Этого я и боялась .	Этого ты и боялась .
Я взял , обмотался .	ты взял , обмотался .
И вдруг хватился я !	И вдруг хватился ты !
Я сам пробовал рукой .	ты сам пробовал рукой .
Я нашел это место .	ты нашел это место .
Я уж различал пень .	ты уж различал пень .
Я очутился в овраге .	ты очутился в овраге .
Я последний раз попробовал .	ты последний раз попробовал .
И тут я заплакал .	И тут ты заплакал .
Я пошел в проход .	ты пошел в проход .
Я зацеплял потолок головой .	ты зацеплял потолок головой .
На минуту я струсил .	На минуту ты струсил .
Я проверил направление подкопа .	ты проверил направление подкопа .
Я лежал на койке .	ты лежал на койке .
Я дополз до поворота .	ты дополз до поворота .
Я перенес астролябию дальше .	ты перенес астролябию дальше .
Я двинулся на выручку .	ты двинулся на выручку .
Я говорю - русские .	ты говоришь - русские .
И я потом заревел .	И ты потом заревел .
Я там нитками замотал .	ты там нитками замотал .
Я пошел к воде .	ты пошел к воде .
Я взялся за руль .	ты взялся за руль .
Я даже струхнул сначала .	ты даже струхнул сначала .
Я поймал его руку .	ты поймал его руку .
Я выскочил , дохнул .	ты выскочил , дохнул .
Я искал глазами турка .	ты искал глазами турка .
Я давил утопленнику живот .	ты давил утопленнику живот .
Дома я завязал руку .	Дома ты завязал руку .
Я пошел к Пантюшке .	ты пошел к Пантюшке .
Я бросился к дверям .	ты бросился к дверям .
А Левку я знал .	А Левку ты знал .
Я на дворе спал .	ты на дворе спал .
И я гребу слабей .	И ты гребешь слабей .
А я разве навязывался ?	А ты разве навязывался ?
Я и весла бросил .	ты и весла бросил .
Ничего я не знаю .	Ничего ты не знаешь .
Я взял и заснул .	ты взял и заснул .
Я чуть двинулся вперёд .	ты чуть двинулся вперёд .
Я с горя заснул .	ты с горя заснул .
Я на миг остановился .	ты на миг остановился .
Я побежал к маме .	ты побежал к маме .
Я таких не люблю .	ты таких не любишь .
Я на стол кладу .	ты на стол кладешь .
Я скорей откусил кусок .	ты скорей откусил кусок .
Потом я семафор видел .	Потом ты семафор видел .
Потому что я кнопочку пихнул .	Потому что ты кнопочку пихнул .
КАК Я ЕЗДИЛ В МЕТРО	КАК ты ЕЗДИЛ В МЕТРО
Я всё своё съел .	ты всё своё съел .
А я немножко испугался .	А ты немножко испугался .
КАК Я ЛЮБЕ ЗВЕРЕЙ ПОКАЗЫВАЛ	КАК ты ЛЮБЕ ЗВЕРЕЙ ПОКАЗЫВАЛ
Я больше ноги смотрел .	ты больше ноги смотрел .
Я тоже шапкой махал .	ты тоже шапкой махал .
Я взял и доел .	ты взял и доел .
И я тоже присел .	И ты тоже присел .
Я думал - кожаный .	ты думал - кожаный .
Я взял и заплакал .	ты взял и заплакал .
Я тоже не плакал .	ты тоже не плакал .
Я по солнцу знаю .	ты по солнцу знаешь .
А потом я заснул .	А потом ты заснул .
Я хочу на пароход !	ты хочешь на пароход !
Я схватился за бабушку .	ты схватился за бабушку .
А я не сказал .	А ты не сказал .
А я не захотел .	А ты не захотел .
КАК Я С ВИТЕЙ ДРАЛСЯ	КАК ты С ВИТЕЙ ДРАЛСЯ
Я никого не боялся .	ты никого не боялся .
Я посмотрел на плитку .	ты посмотрел на плитку .
Я рассердился на бабушку .	ты рассердился на бабушку .
А я не пускал .	А ты не пускал .
КАК Я КАТАЛСЯ НА ЛОШАДИ	КАК ты КАТАЛСЯ НА ЛОШАДИ
КАК Я РАССЕРДИЛСЯ НА ДЕВОЧКУ	КАК ты РАССЕРДИЛСЯ НА ДЕВОЧКУ
Я завтра сюда приду .	ты завтра сюда придешь .
Я сел на сундук .	ты сел на сундук .
А я не боюсь .	А ты не боишься .
И я тоже побежал .	И ты тоже побежал .
Я бабушке ягоды отдал .	ты бабушке ягоды отдал .
Я слезал и упал .	ты слезал и упал .
КАК Я В ШАЛАШЕ СПАЛ	КАК ты В ШАЛАШЕ СПАЛ
Вдруг я увидел лестницу .	Вдруг ты увидел лестницу .
Это чтоб я молчал .	Это чтоб ты молчал .
И я тоже пел .	И ты тоже пел .
А чтоб я сидел .	А чтоб ты сидел .
КАК Я НАБЕЖАЛ НА КОЗОЧКУ	КАК ты НАБЕЖАЛ НА КОЗОЧКУ
Я сел под окном .	ты сел под окном .
КАК Я НА КОЗЛЕ КАТАЛСЯ	КАК ты НА КОЗЛЕ КАТАЛСЯ
А я не узнал .	А ты не узнал .
И я немножко понимал .	И ты немножко понимал .
Я немножко даже заплакал .	ты немножко даже заплакал .
А я не устал .	А ты не устал .
Я руку назад выдернул .	ты руку назад выдернул .
КАК Я ПРО МОСКВУ ГОВОРИЛ	КАК ты ПРО МОСКВУ ГОВОРИЛ
КАКИЕ Я ЕЩЕ БУКВЫ УЗНАЛ	КАКИЕ ты ЕЩЕ БУКВЫ УЗНАЛ
И что я спал .	И что ты спал .
Я пойду , сосну .	ты пойдешь , соснешь .
Я смешанные браки разрешил .	ты смешанные браки разрешил .
Я множество галактик повидал .	ты множество галактик повидал .
Я и так слышу .	ты и так слышишь .
Я один не могу .	ты один не можешь .
Я прочитала воронину бумажку .	ты прочитала воронину бумажку .
Я нашел большущий гриб !..	ты нашел большущий гриб !..
