Я ведь не собирался ...	ты ведь не собирался ...
Я в лепешку разобьюсь .	ты в лепешку разобьешься .
Это я помню точно .	Это ты помнишь точно .
Сначала я поищу клоуна .	Сначала ты поищешь клоуна .
Я заплачу за это .	ты заплатишь за это .
И я съем одно .	И ты съешь одно .
Видела я эту уборщицу .	Видела ты эту уборщицу .
Да , я знаю .	Да , ты знаешь .
Поэтому приказания отдаю я .	Поэтому приказания отдаешь ты .
Я сегодня еще сделаю .	ты сегодня еще сделаешь .
Но я знала это !	Но ты знала это !
Зачем только я проговорился ?	Зачем только ты проговорился ?
Я чувствую себя счастливым !	ты чувствуешь себя счастливым !
Знаю я вашу Семерку !	знаешь ты вашу Семерку !
Вот я и пойду .	Вот ты и пойдешь .
А я принес лимонад .	А ты принес лимонад .
Я там обязательно буду .	ты там обязательно будешь .
Я это точно видел .	ты это точно видел .
Я тоже семафор учу .	ты тоже семафор учишь .
А я опять поехал .	А ты опять поехал .
Тогда я узнал капитана .	Тогда ты узнал капитана .
Я и есть Буденный .	ты и есть Буденный .
Я еще не проводила .	ты еще не проводила .
Я бы не промахнулся .	ты бы не промахнулся .
И я не унываю .	И ты не унываешь .
Я нагнулся к Кате .	ты нагнулся к Кате .
Это я заказала заранее .	Это ты заказала заранее .
Лешего я сам видал .	Лешего ты сам видал .
Я террору не поддамся !	ты террору не поддашься !
Сюда ли я попал ?	Сюда ли ты попал ?
Обвиняемых я уже пригласил .	Обвиняемых ты уже пригласил .
Я так и знала .	ты так и знала .
Уж это я знаю ...	Уж это ты знаешь ...
А остатки я подбрил ...	А остатки ты подбрил ...
Я взял свою тетрадку .	ты взял свою тетрадку .
Я и не вмешивался .	ты и не вмешивался .
Я медленно перемещаю лупу .	ты медленно перемещаешь лупу .
Зачем я это спросил ?	Зачем ты это спросил ?
Я вез домой Васю .	ты вез домой Васю .
Я вышел на площадку .	ты вышел на площадку .
Я пошел к дому .	ты пошел к дому .
Откуда я это знаю ?	Откуда ты это знаешь ?
Я вернулся в дом .	ты вернулся в дом .
Весь вечер я думал .	Весь вечер ты думал .
Я осторожно сжал пальцы .	ты осторожно сжал пальцы .
Я не винил мать .	ты не винил мать .
За Каштаном иду я .	За Каштаном идешь ты .
Однако я добился своего .	Однако ты добился своего .
От ужаса я проснулся .	От ужаса ты проснулся .
Я посмотрел на часы .	ты посмотрел на часы .
Я открыл учебник истории .	ты открыл учебник истории .
Я присел и присмотрелся .	ты присел и присмотрелся .
Я тут же прилечу .	ты тут же прилетишь .
Я подошел к Отелло .	ты подошел к Отелло .
И вдруг я понял .	И вдруг ты понял .
Я шел не спеша .	ты шел не спеша .
Я пошарил в траве .	ты пошарил в траве .
О чём я думал ?	О чём ты думал ?
Теперь я видел змею .	Теперь ты видел змею .
Я присел на траву .	ты присел на траву .
Я издаю тихий свист .	ты издаешь тихий свист .
Теперь я всё понял .	Теперь ты всё понял .
Я посмотрел на петуха .	ты посмотрел на петуха .
Через час я вернулся .	Через час ты вернулся .
И что я увидел ?	И что ты увидел ?
Я быстро открыл ворота .	ты быстро открыл ворота .
Я едва не заревел .	ты едва не заревел .
Я подошел к Серому .	ты подошел к Серому .
Я сел на траву .	ты сел на траву .
Я пошел в школу .	ты пошел в школу .
И тут я задумался .	И тут ты задумался .
Дальше я работал быстро .	Дальше ты работал быстро .
Я просмотрел весь список .	ты просмотрел весь список .
Среди ночи я проснулся .	Среди ночи ты проснулся .
Поэтому я и проснулся .	Поэтому ты и проснулся .
Неужели это написал я ?	Неужели это написал ты ?
Раздумывал я не долго .	Раздумывал ты не долго .
Зато я все видел .	Зато ты все видел .
Так я и стоял .	Так ты и стоял .
Я зашел в дом .	ты зашел в дом .
Я забыл про утят .	ты забыл про утят .
И тут я сообразил .	И тут ты сообразил .
И тут я понял ...	И тут ты понял ...
Я научусь этому потом .	ты научишься этому потом .
Я не боюсь опасности .	ты не боишься опасности .
Я отвечу на любой .	ты ответишь на любой .
Я всегда так делаю ...	ты всегда так делаешь ...
Я потерял одну ногу .	ты потерял одну ногу .
Я ем и сомневаюсь ...	ты ешь и сомневаешься ...
Я не замышляю зла .	ты не замышляешь зла .
Я вернусь за сумой .	ты вернешься за сумой .
Я вижу только лес .	ты видишь только лес .
Я так есть хочу ...	ты так есть хочешь ...
А я сама уйду !	А ты сама уйдешь !
Я иду в поссовет .	ты идешь в поссовет .
Я включил настольную лампу .	ты включил настольную лампу .
Я взял осторожно цветы .	ты взял осторожно цветы .
Я пошел на лай .	ты пошел на лай .
Лошадей я сразу узнал .	Лошадей ты сразу узнал .
А я все сомневаюсь .	А ты все сомневаешься .
Я подбежала к окну .	ты подбежала к окну .
Вот осмотрел я лабораторию .	Вот осмотрел ты лабораторию .
Я шел в библиотеку .	ты шел в библиотеку .
Я поднялся со стула .	ты поднялся со стула .
Я играл роль Волошина .	ты играл роль Волошина .
Я ушел за город .	ты ушел за город .
Я отбежал к дверям .	ты отбежал к дверям .
Я сидел у окна .	ты сидел у окна .
Я устроился в труппу .	ты устроился в труппу .
Я увидел гнездо ос .	ты увидел гнездо ос .
Я барахтался , карабкался ...	ты барахтался , карабкался ...
Я замер ... . .	ты замер ... . .
Этим я спас себя .	Этим ты спас себя .
Я ринулся к шару .	ты ринулся к шару .
Я перескочил на другую .	ты перескочил на другую .
Я кинулся в обход .	ты кинулся в обход .
Так говорил я себе .	Так говорил ты себе .
Я в страхе упал .	ты в страхе упал .
Я спрятался под куст .	ты спрятался под куст .
Я соскочил на землю .	ты соскочил на землю .
Я пошарил около гнезда .	ты пошарил около гнезда .
Я сидел под навесом .	ты сидел под навесом .
Как я испугался тогда !	Как ты испугался тогда !
Я шел по пустыне .	ты шел по пустыне .
Я иду на северо-восток .	ты идешь на северо-восток .
Все это я знал давно .	Все это ты знал давно .
Я сидел на берегу .	ты сидел на берегу .
Я доплыл до берега .	ты доплыл до берега .
Я смотрел , наблюдал .	ты смотрел , наблюдал .
И все же я заснул .	И все же ты заснул .
Я пел все громче .	ты пел все громче .
Я умолк , прислушался .	ты умолк , прислушался .
Я вспоминал жалобы больных .	ты вспоминал жалобы больных .
Я углубился в травы .	ты углубился в травы .
Этого я не знал .	Этого ты не знал .
Я отбежал в сторону .	ты отбежал в сторону .
Я опустился на подстилку .	ты опустился на подстилку .
Но я снова прислушиваюсь .	Но ты снова прислушиваешься .
Я сказал это резко .	ты сказал это резко .
Я шел вслед за Думчевым .	ты шел вслед за Думчевым .
Я всматривался , размышлял .	ты всматривался , размышлял .
Но все же я добрался .	Но все же ты добрался .
Я был в отчаянии .	ты был в отчаянии .
Я посмотрел на Думчева .	ты посмотрел на Думчева .
Я отбежал , остановился .	ты отбежал , остановился .
Я взял стебель растения .	ты взял стебель растения .
Завтра я ставлю опыт ...	Завтра ты ставишь опыт ...
Я выскочил из подвала .	ты выскочил из подвала .
Я улыбнулся своим воспоминаниям .	ты улыбнулся своим воспоминаниям .
Я уходил в библиотеку .	ты уходил в библиотеку .
Я учту наблюдение Думчева .	ты учтешь наблюдение Думчева .
Я устал от пережитого .	ты устал от пережитого .
Я посидел на скамейке .	ты посидел на скамейке .
Я посмотрел на Калганова .	ты посмотрел на Калганова .
Я ведь уже спрашивала .	ты ведь уже спрашивала .
Я поведу себя сам .	ты поведешь себя сам .
Вот я и кукарекнул .	Вот ты и кукарекнул .
Я ищу Яцека Килара .	ты ищешь Яцека Килара .
Лучше я еще подожду .	Лучше ты еще подождешь .
Я сейчас там буду !	ты сейчас там будешь !
А я мог многое .	А ты мог многое .
Я выжидал удобной минуты .	ты выжидал удобной минуты .
Я колебался только мгновение .	ты колебался только мгновение .
Я уже это продумал .	ты уже это продумал .
Я лишь исполняю приказ .	ты лишь исполняешь приказ .
Я помню их улыбки .	ты помнишь их улыбки .
Я повернулся , и ...	ты повернулся , и ...
Подумала я , поглядела .	Подумала ты , поглядела .
Это так я помню .	Это так ты помнишь .
Я купил хороший нож .	ты купил хороший нож .
Я вынул мой нож .	ты вынул мой нож .
Я совершил ужасный грех .	ты совершил ужасный грех .
Я совершил много злодеяний .	ты совершил много злодеяний .
Я Кудлашке мясца дам .	ты Кудлашке мясца дашь .
Я милого дружочка поджидала ...	ты милого дружочка поджидала ...
Я не буду эгоисткой .	ты не будешь эгоисткой .
Как долго я спала ?	Как долго ты спала ?
Давно я не катался !	Давно ты не катался !
Я её рыбой кормлю .	ты её рыбой кормишь .
Я сажусь за стол .	ты садишься за стол .
Это я сама знаю ...	Это ты сама знаешь ...
Я огляделся ещё раз .	ты огляделся ещё раз .
Я бью по мячу .	ты бьешь по мячу .
Я тоже скажу публик ...	ты тоже скажешь публик ...
Я в больнице был .	ты в больнице был .
Я и сдачи дам .	ты и сдачи дашь .
Про герцога я наврал .	Про герцога ты наврал .
Я слушал , зачарованный .	ты слушал , зачарованный .
Я остановился у калитки .	ты остановился у калитки .
Я лег и задремал .	ты лег и задремал .
Я вздохнул и пошел .	ты вздохнул и пошел .
Книжку эту я купил .	Книжку эту ты купил .
Я посижу около будочки .	ты посидишь около будочки .
Я все буквы знаю !	ты все буквы знаешь !
Я сама еще прочту .	ты сама еще прочтешь .
Я закрыл лицо руками .	ты закрыл лицо руками .
На руках я затихал .	На руках ты затихал .
Я чаю не хотел .	ты чаю не хотел .
И я опять побежал .	И ты опять побежал .
Я чуточку приоткрыл дверь .	ты чуточку приоткрыл дверь .
Я полицаю свистал буду .	ты полицаю свистал будешь .
И я не беру .	И ты не берешь .
Вот я и кормлюсь .	Вот ты и кормишься .
Я пошел к доске .	ты пошел к доске .
Я овса не ем .	ты овса не ешь .
Ведь я же вижу !	Ведь ты же видишь !
Я в ночлежке ночую .	ты в ночлежке ночуешь .
Купцов я не любил .	Купцов ты не любил .
Я от радости онемел .	ты от радости онемел .
Заснул я не скоро .	Заснул ты не скоро .
А я бы нашел !	А ты бы нашел !
Я обвел глазами небо .	ты обвел глазами небо .
Я трачу в пять раз больше .	ты тратишь в пять раз больше .
Я тут кое-что подготовил .	ты тут кое-что подготовил .
Невольно я опустил глаза .	Невольно ты опустил глаза .
Я там клад искал ...	ты там клад искал ...
Я ничего не утаил .	ты ничего не утаил .
Нахохлившись , я молчал .	Нахохлившись , ты молчал .
Я отпрянул от ворот .	ты отпрянул от ворот .
Я заметался по двору .	ты заметался по двору .
Я проживу сто лет .	ты проживешь сто лет .
Но я не плакал .	Но ты не плакал .
Кажется , я плачу .	Кажется , ты плачешь .
Я прошел по рядам .	ты прошел по рядам .
Я четыре раза смотрел .	ты четыре раза смотрел .
Я взял ее руку .	ты взял ее руку .
Как я потом узнал .	Как ты потом узнал .
Так я и сделал .	Так ты и сделал .
Я вышел к столу .	ты вышел к столу .
Я рассказал про КЮК .	ты рассказал про КЮК .
Я начал с математиков .	ты начал с математиков .
Я это ощутил сразу .	ты это ощутил сразу .
Я покосился в журнал .	ты покосился в журнал .
Первое я уже освоил .	Первое ты уже освоил .
Я зашел в класс .	ты зашел в класс .
Или я так задумался ?	Или ты так задумался ?
Остальное я помню смутно .	Остальное ты помнишь смутно .
Я глянул в небо .	ты глянул в небо .
Я шел в школу .	ты шел в школу .
Я пошел в парикмахерскую .	ты пошел в парикмахерскую .
Я обращаюсь к Матюшину .	ты обращаешься к Матюшину .
Что я такое сделал ?	Что ты такое сделал ?
Что-то я совсем расклеился .	Что-то ты совсем расклеился .
И еще я понял .	И еще ты понял .
Это собрание я запомню .	Это собрание ты запомнишь .
Неужели и я забуду ?	Неужели и ты забудешь ?
Я чувствовал его шаги .	ты чувствовал его шаги .
Я достаю автомат и ...	ты достаешь автомат и ...
Я ненавижу его голос .	ты ненавидишь его голос .
Я погнал к Андрею !	ты погнал к Андрею !
Я спрятался за дверью .	ты спрятался за дверью .
Я кинулся к маме .	ты кинулся к маме .
Я с надеждой прислушался .	ты с надеждой прислушался .
Я сидел на песке .	ты сидел на песке .
Я ждал очередного залпа .	ты ждал очередного залпа .
Я глянул в зеркало .	ты глянул в зеркало .
Я сама случайно узнала .	ты сама случайно узнала .
Но я вдруг испугался .	Но ты вдруг испугался .
Зачем я все это вспоминаю ?	Зачем ты все это вспоминаешь ?
Я вздрогнул и оглянулся .	ты вздрогнул и оглянулся .
Я разбил нос учителю ...	ты разбил нос учителю ...
Почему я стала такой ?	Почему ты стала такой ?
Ну и отстал я !	Ну и отстал ты !
Я свернул в рощу .	ты свернул в рощу .
Я боялся этой встречи .	ты боялся этой встречи .
Не могу я так ...	Не можешь ты так ...
Я действительно не знал .	ты действительно не знал .
Я вышел из дому .	ты вышел из дому .
Я даже глаза закрыл .	ты даже глаза закрыл .
Я и был великаном .	ты и был великаном .
Погнал я к Андрею !	Погнал ты к Андрею !
Я разорю ваше гнездо !	ты разоришь ваше гнездо !
Сейчас я завалю фонтан .	Сейчас ты завалишь фонтан .
Это я первый сказал !	Это ты первый сказал !
Я видела в городе ...	ты видела в городе ...
И вдруг я придумала .	И вдруг ты придумала .
Я выхожу во двор .	ты выходишь во двор .
Я взялась за кувшин .	ты взялась за кувшин .
Я принялась за дело .	ты принялась за дело .
Я бросилась на выручку .	ты бросилась на выручку .
Я взглянула на Зинку .	ты взглянула на Зинку .
Но я не верю .	Но ты не веришь .
Я отрицательно качаю головой .	ты отрицательно качаешь головой .
В дверях я обернулась .	В дверях ты обернулась .
Вдруг я увидела маму .	Вдруг ты увидела маму .
Я сразу узнала Таньку .	ты сразу узнала Таньку .
Я ахнула от восхищения .	ты ахнула от восхищения .
И тут я спохватилась .	И тут ты спохватилась .
Я только качала головой .	ты только качала головой .
И вдруг я решилась .	И вдруг ты решилась .
Я осторожно тронула калитку .	ты осторожно тронула калитку .
Я обрадованно замахала рукой .	ты обрадованно замахала рукой .
Я так и подпрыгнула .	ты так и подпрыгнула .
Я вылетаю во двор .	ты вылетаешь во двор .
Я так и подскочила .	ты так и подскочила .
Вдруг я увидела Павлика .	Вдруг ты увидела Павлика .
Я жду - у !	ты ждешь - у !
Я нежился под душем .	ты нежился под душем .
Наверно , я покраснел .	Наверно , ты покраснел .
Я шел среди тишины .	ты шел среди тишины .
Такого я не ожидал .	Такого ты не ожидал .
Я летал в Студгородок !	ты летал в Студгородок !
Я пропустил что-то интересное ?	ты пропустил что-то интересное ?
Сейчас я искал свое .	Сейчас ты искал свое .
Я пожал ребятам руку .	ты пожал ребятам руку .
А рядом стою я .	А рядом стоишь ты .
А что я мог ?	А что ты мог ?
Я вышел вслед за Игорем .	ты вышел вслед за Игорем .
Такое я видел впервые .	Такое ты видел впервые .
Я представил лица товарищей .	ты представил лица товарищей .
Я сам не мог .	ты сам не мог .
Я верил в это .	ты верил в это .
Я выдержал пристальный взгляд .	ты выдержал пристальный взгляд .
Если я сам выдержу ...	Если ты сам выдержишь ...
Я чувствовал себя сильным .	ты чувствовал себя сильным .
Я замер , пригляделся .	ты замер , пригляделся .
Я лежал на диване .	ты лежал на диване .
Осторожно держал я рукописи .	Осторожно держал ты рукописи .
Я поспешно натянул комбинезон .	ты поспешно натянул комбинезон .
Я нисколько не шучу .	ты нисколько не шутишь .
Я улетал к Солнцу .	ты улетал к Солнцу .
Я уже дал согласие !	ты уже дал согласие !
Эту игру выиграл я !	Эту игру выиграл ты !
Я открыл вечную истину ...	ты открыл вечную истину ...
Я не вижу выхода .	ты не видишь выхода .
Я на лестнице видела .	ты на лестнице видела .
Я вторгся так неожиданно .	ты вторгся так неожиданно .
Я отсидел пять уроков !	ты отсидел пять уроков !
